{
  "schema": "cortex-storage-benchmark-report-v1",
  "command": "node scripts/benchmark-storage.mjs --fixture-files 550 --samples 5",
  "source": {
    "commit": "590593de3e3708ab7081b5c2b7a9617310a35426",
    "root": "/Volumes/D/claude/cortex",
    "worktree": "dirty"
  },
  "fixture": {
    "id": "cortex-storage-550-v1",
    "fixtureVersion": 1,
    "seed": "cortex-storage-v1",
    "files": 550,
    "updatePaths": 100,
    "contentSha256": "a1bfdfc1d83bd13a6961cf3726c0adf494077b56c6e96f7ed5983d7257046289"
  },
  "host": {
    "hostname": "Adrians-MacBook-Air.local",
    "platform": "darwin",
    "arch": "arm64",
    "release": "25.5.0",
    "node": "v26.5.0",
    "sqlite": "3.53.3"
  },
  "samples": 5,
  "metrics": {
    "coldBuild": {
      "samples": [
        {
          "elapsedMs": 941.0214580000002,
          "peakRssBytes": 247955456,
          "stdout": "built .agent/map.json docs=0 claims=0 manifest=.agent/manifest.json product=docs/product.md architecture=docs/architecture.md phase1_ready full_cortex=incomplete next=phase2",
          "rssProbe": "ps -o rss= -p <pid> (10ms interval)"
        },
        {
          "elapsedMs": 840.092625,
          "peakRssBytes": 248610816,
          "stdout": "built .agent/map.json docs=0 claims=0 manifest=.agent/manifest.json product=docs/product.md architecture=docs/architecture.md phase1_ready full_cortex=incomplete next=phase2",
          "rssProbe": "ps -o rss= -p <pid> (10ms interval)"
        },
        {
          "elapsedMs": 819.0564590000001,
          "peakRssBytes": 247169024,
          "stdout": "built .agent/map.json docs=0 claims=0 manifest=.agent/manifest.json product=docs/product.md architecture=docs/architecture.md phase1_ready full_cortex=incomplete next=phase2",
          "rssProbe": "ps -o rss= -p <pid> (10ms interval)"
        },
        {
          "elapsedMs": 739.236042,
          "peakRssBytes": 245284864,
          "stdout": "built .agent/map.json docs=0 claims=0 manifest=.agent/manifest.json product=docs/product.md architecture=docs/architecture.md phase1_ready full_cortex=incomplete next=phase2",
          "rssProbe": "ps -o rss= -p <pid> (10ms interval)"
        },
        {
          "elapsedMs": 840.1570840000004,
          "peakRssBytes": 248545280,
          "stdout": "built .agent/map.json docs=0 claims=0 manifest=.agent/manifest.json product=docs/product.md architecture=docs/architecture.md phase1_ready full_cortex=incomplete next=phase2",
          "rssProbe": "ps -o rss= -p <pid> (10ms interval)"
        }
      ],
      "p95Ms": 941.0214580000002,
      "peakRssBytes": 248610816
    },
    "noChange": {
      "samples": [
        {
          "elapsedMs": 812.1190420000003,
          "peakRssBytes": 250413056,
          "stdout": "built .agent/map.json docs=0 claims=0 manifest=.agent/manifest.json product=docs/product.md architecture=docs/architecture.md phase1_ready full_cortex=incomplete next=phase2",
          "rssProbe": "ps -o rss= -p <pid> (10ms interval)"
        },
        {
          "elapsedMs": 954.1053750000001,
          "peakRssBytes": 250757120,
          "stdout": "built .agent/map.json docs=0 claims=0 manifest=.agent/manifest.json product=docs/product.md architecture=docs/architecture.md phase1_ready full_cortex=incomplete next=phase2",
          "rssProbe": "ps -o rss= -p <pid> (10ms interval)"
        },
        {
          "elapsedMs": 780.7194999999992,
          "peakRssBytes": 250249216,
          "stdout": "built .agent/map.json docs=0 claims=0 manifest=.agent/manifest.json product=docs/product.md architecture=docs/architecture.md phase1_ready full_cortex=incomplete next=phase2",
          "rssProbe": "ps -o rss= -p <pid> (10ms interval)"
        },
        {
          "elapsedMs": 824.3144590000002,
          "peakRssBytes": 249970688,
          "stdout": "built .agent/map.json docs=0 claims=0 manifest=.agent/manifest.json product=docs/product.md architecture=docs/architecture.md phase1_ready full_cortex=incomplete next=phase2",
          "rssProbe": "ps -o rss= -p <pid> (10ms interval)"
        },
        {
          "elapsedMs": 828.4172500000004,
          "peakRssBytes": 245891072,
          "stdout": "built .agent/map.json docs=0 claims=0 manifest=.agent/manifest.json product=docs/product.md architecture=docs/architecture.md phase1_ready full_cortex=incomplete next=phase2",
          "rssProbe": "ps -o rss= -p <pid> (10ms interval)"
        }
      ],
      "p95Ms": 954.1053750000001,
      "peakRssBytes": 250757120
    },
    "oneFileDelta": {
      "samples": [
        {
          "elapsedMs": 28.14770900000076,
          "applied": true,
          "peakRssBytes": 77365248
        },
        {
          "elapsedMs": 15.669667000000118,
          "applied": true,
          "peakRssBytes": 80052224
        },
        {
          "elapsedMs": 21.476082999999562,
          "applied": true,
          "peakRssBytes": 83017728
        },
        {
          "elapsedMs": 16.92291699999987,
          "applied": true,
          "peakRssBytes": 83509248
        },
        {
          "elapsedMs": 14.201374999998734,
          "applied": true,
          "peakRssBytes": 84099072
        }
      ],
      "p95Ms": 28.14770900000076,
      "peakRssBytes": 84099072
    },
    "residentExactLookup": {
      "state": "not_configured",
      "samples": [],
      "p95Ms": null,
      "embeddedControl": {
        "elapsedMs": 0.36420800000087183,
        "rows": 2,
        "label": "not a resident-daemon measurement"
      }
    },
    "fixed100FileUpdate": {
      "files": 100,
      "elapsedMs": 3476.691917,
      "samples": [
        {
          "elapsedMs": 13.401417000000947,
          "applied": true,
          "peakRssBytes": 86802432
        },
        {
          "elapsedMs": 13.148459000000003,
          "applied": true,
          "peakRssBytes": 89358336
        },
        {
          "elapsedMs": 15.617457999998805,
          "applied": true,
          "peakRssBytes": 91242496
        },
        {
          "elapsedMs": 13.31237499999952,
          "applied": true,
          "peakRssBytes": 94437376
        },
        {
          "elapsedMs": 14.312540999999328,
          "applied": true,
          "peakRssBytes": 95584256
        },
        {
          "elapsedMs": 12.36266699999942,
          "applied": true,
          "peakRssBytes": 95862784
        },
        {
          "elapsedMs": 12.188375000001543,
          "applied": true,
          "peakRssBytes": 96190464
        },
        {
          "elapsedMs": 12.299542000000656,
          "applied": true,
          "peakRssBytes": 96468992
        },
        {
          "elapsedMs": 12.006250000000364,
          "applied": true,
          "peakRssBytes": 96796672
        },
        {
          "elapsedMs": 20.825667000000976,
          "applied": true,
          "peakRssBytes": 97075200
        },
        {
          "elapsedMs": 15.438624999998865,
          "applied": true,
          "peakRssBytes": 97419264
        },
        {
          "elapsedMs": 12.832958000000872,
          "applied": true,
          "peakRssBytes": 97697792
        },
        {
          "elapsedMs": 14.693375000000742,
          "applied": true,
          "peakRssBytes": 99565568
        },
        {
          "elapsedMs": 13.572541000001365,
          "applied": true,
          "peakRssBytes": 100007936
        },
        {
          "elapsedMs": 12.92950000000019,
          "applied": true,
          "peakRssBytes": 100057088
        },
        {
          "elapsedMs": 12.084208000000217,
          "applied": true,
          "peakRssBytes": 100073472
        },
        {
          "elapsedMs": 12.546625000000859,
          "applied": true,
          "peakRssBytes": 100106240
        },
        {
          "elapsedMs": 13.373999999999796,
          "applied": true,
          "peakRssBytes": 100712448
        },
        {
          "elapsedMs": 13.197041999999783,
          "applied": true,
          "peakRssBytes": 100712448
        },
        {
          "elapsedMs": 13.067333999999391,
          "applied": true,
          "peakRssBytes": 100712448
        },
        {
          "elapsedMs": 12.818832999999358,
          "applied": true,
          "peakRssBytes": 100728832
        },
        {
          "elapsedMs": 12.247624999999971,
          "applied": true,
          "peakRssBytes": 100777984
        },
        {
          "elapsedMs": 11.459917000000132,
          "applied": true,
          "peakRssBytes": 101040128
        },
        {
          "elapsedMs": 14.187416999999186,
          "applied": true,
          "peakRssBytes": 101040128
        },
        {
          "elapsedMs": 13.956125000000611,
          "applied": true,
          "peakRssBytes": 101728256
        },
        {
          "elapsedMs": 13.657042000000729,
          "applied": true,
          "peakRssBytes": 105005056
        },
        {
          "elapsedMs": 14.531833000000915,
          "applied": true,
          "peakRssBytes": 108314624
        },
        {
          "elapsedMs": 13.632791999998517,
          "applied": true,
          "peakRssBytes": 109740032
        },
        {
          "elapsedMs": 14.453292000000147,
          "applied": true,
          "peakRssBytes": 109494272
        },
        {
          "elapsedMs": 27.853374999998778,
          "applied": true,
          "peakRssBytes": 110329856
        },
        {
          "elapsedMs": 24.162249999999403,
          "applied": true,
          "peakRssBytes": 113590272
        },
        {
          "elapsedMs": 20.588541999999507,
          "applied": true,
          "peakRssBytes": 116916224
        },
        {
          "elapsedMs": 17.26012499999888,
          "applied": true,
          "peakRssBytes": 117899264
        },
        {
          "elapsedMs": 14.647917000000234,
          "applied": true,
          "peakRssBytes": 117850112
        },
        {
          "elapsedMs": 16.41412499999933,